{
  "agent_name": "report_judge",
  "decision_stage": "draft",
  "evidence_weight": {
    "contradiction": 0,
    "downside": 78,
    "priced_in": 6,
    "upside": 16
  },
  "hypothesis_impact": {
    "label": "negative",
    "summary": "現段階では価格Evidence中心のため、仮説更新は暫定扱いにする。"
  },
  "information_status": {
    "label": "downside_evidence_leading",
    "summary": "価格・出来高EvidenceをAgentTeam形式に整理した。追加情報で判断精度を上げる余地がある。"
  },
  "market_readout": {
    "confidence": "medium",
    "evidence_balance_score": -62,
    "label": "downside",
    "summary": "Evidence 18件を確認。終値1645.5は始値1653.5を下回った。出来高は2480300.0。"
  },
  "missing_information": [
    {
      "importance": "high",
      "item": "直近ニュースとIR",
      "reason": "価格変動の背景に材料があるかを確認するため"
    },
    {
      "importance": "medium",
      "item": "EDINET開示と決算指標",
      "reason": "短期価格反応と中期ファンダメンタルズを分けるため"
    },
    {
      "importance": "medium",
      "item": "同業比較と指数比較",
      "reason": "個別要因か市場全体の動きかを切り分けるため"
    }
  ],
  "run_at": "2026-07-04T23:14:04+09:00",
  "run_id": "PIPE-20250328-TARGET-SAMPLE-8697-RESEARCH-JUDGE",
  "schema_version": "report_readout_v1",
  "target": {
    "company_name": "日本取引所グループ",
    "market": "prime",
    "stock_code": "8697",
    "target_id": "TARGET-SAMPLE-8697",
    "target_type": "stock",
    "themes": [
      "取引所"
    ]
  },
  "uncertainty": {
    "factors": [
      "J-Quants価格データ以外の材料が未統合",
      "ニュース、IR、EDINET、同業比較が未確認",
      "AI推論ではなく deterministic baseline による整理"
    ],
    "level": "medium"
  },
  "used_evidence": [
    {
      "evidence_id": "E20250328-001",
      "reason": "2025-03-28の86970日次価格データをJ-Quantsから取得。 終値は1645.5。 出来高は2480300.0。 売買代金は4084779250.0。",
      "role": "downside"
    },
    {
      "evidence_id": "E20250328-002",
      "reason": "2025-03-28の86970日次価格データをJ-Quantsから取得。 終値は1650.0。 出来高は3174600.0。 売買代金は5255286550.0。",
      "role": "downside"
    },
    {
      "evidence_id": "E20250328-003",
      "reason": "2025-03-28の86970日次価格データをJ-Quantsから取得。 終値は1651.5。 出来高は4075900.0。 売買代金は6755232500.0。",
      "role": "downside"
    },
    {
      "evidence_id": "E20250328-004",
      "reason": "2025-03-28の86970日次価格データをJ-Quantsから取得。 終値は1657.0。 出来高は4007000.0。 売買代金は6610263950.0。",
      "role": "upside"
    },
    {
      "evidence_id": "E20250328-005",
      "reason": "2025-03-28の86970日次価格データをJ-Quantsから取得。 終値は1580.0。 出来高は4604900.0。 売買代金は7282456700.0。",
      "role": "downside"
    },
    {
      "evidence_id": "E20250328-051",
      "reason": "2025-03-28の86970についてJ-Quants価格データから派生指標を算出。 前日比は-4.647。 始値比は-2.0459。 日中レンジは4.0298。 5日平均比出来高は1.2552。",
      "role": "downside"
    },
    {
      "evidence_id": "E20250328-061",
      "reason": "2025-03-28の86970を比較対象と相対比較。 JPXSelf比のclose_to_open_pct差は0.0pt。",
      "role": "neutral"
    },
    {
      "evidence_id": "E20250328-201",
      "reason": "2025-03-28にjpx.co.jpで関連ニュースを確認。タイトル: Launch of 10-Level Order Book Historical Data - jpx.co.jp 概要: <a href=\"https://news.google.com/rss/articles/CBMihwFBVV95cUxNcWl1NTdpQnhydkN6NUY0OG1tR3gwSm14TF9vbjNZcmduX0hoRjZjOU5ISlNQQmQwS2I4Yl9sUk56ME5rbHRJUVBiUDYtZDZKU3JLWmtCRkJleHJvQ3hpYV",
      "role": "unknown"
    },
    {
      "evidence_id": "E20250328-202",
      "reason": "2025-03-28にTradingViewで関連ニュースを確認。タイトル: Price to earnings forward of Japan Exchange Group, Inc. – TSE:8697 - TradingView 概要: <a href=\"https://news.google.com/rss/articles/CBMingFBVV95cUxQLWJMYk5YdFBaRXowWEU3dU8yQjViQ0dlRW1teGIzNTB4VEJwQWhENXZHdjBBcFFITzNsbVc2clltVnZEcFBQZ2VJaDY4NU10a1Q2UWtwa0d5RGZNNEplZH",
      "role": "unknown"
    },
    {
      "evidence_id": "E20250328-203",
      "reason": "2025-03-28にBBN Timesで関連ニュースを確認。タイトル: Japan Exchange Group Today: Nikkei 225 Climbs Toward 70,500 as Yen Hits 40-Year Low and AI Stocks Drive Tokyo's Second-Half Opener - BBN Times 概要: <a href=\"https://news.google.com/rss/articles/CBMi9wFBVV95cUxOXzZYRXFoY2xrN0NtUVNLLUxmYkxmeENFcXBFNU5pRHdLTm1md2F3bzdBRjBBYzIya3dpYkFmaFM2c01nWThVS3BGMlJJNVNiWHVFc096cVFtdUtVcjhXMF",
      "role": "unknown"
    },
    {
      "evidence_id": "E20250328-204",
      "reason": "2025-03-28にmarketscreener.comで関連ニュースを確認。タイトル: Tranche Update on Japan Exchange Group, Inc.'s Equity Buyback Plan announced on April 28, 2026. - marketscreener.com 概要: <a href=\"https://news.google.com/rss/articles/CBMi3AFBVV95cUxNT0NJdE5VdGhhRFRKbzg0SGZrdXhKN1o5WFNUb2tMcEFJc1YzeU5WQWZFQ2JxeEtsdXJfMHNRazMybEFvOERSSExnQWoxdHBnLXhBWE1qX09DRkp5bEgxLV",
      "role": "unknown"
    },
    {
      "evidence_id": "E20250328-205",
      "reason": "2025-03-28にPR Newswireで関連ニュースを確認。タイトル: RavenPack Partners with Japan Exchange Group's SCRIPTS Asia team to Provide AI-Ready Data on Japanese Equities - PR Newswire 概要: <a href=\"https://news.google.com/rss/articles/CBMi-AFBVV95cUxQOVF0Zm5BQkdfOVFNai1rYThiTFpRdEhrbUtYZ1ZMaFVIaFFoZEFsMjVQenAwd1BXb213U0o2SVd2YU16UlVEc1lzd2V5akVsVVMtUjdNcVZMdUlQa1pEa3",
      "role": "unknown"
    },
    {
      "evidence_id": "E20250328-206",
      "reason": "2025-03-28にReutersで関連ニュースを確認。タイトル: Japan's Nikkei retreats from record high as AI rally sparks caution - Reuters 概要: <a href=\"https://news.google.com/rss/articles/CBMirwFBVV95cUxPbDk3dFlfUnRiejJ5a3BKSWFqY0NrbGFzYktBS2ZaYm1PRm1KUURFYkdqRGZiN3NYUk96SGxYSXBIUUFzWW9RT1QxMi1ONlJJNVdGYWNkdTktc1U2b2h2UE",
      "role": "unknown"
    },
    {
      "evidence_id": "E20250328-207",
      "reason": "2025-03-28にWSJで関連ニュースを確認。タイトル: Japan Exchange Group CEO Urges Nidec to Improve Controls Amid Accounting Probe - WSJ 概要: <a href=\"https://news.google.com/rss/articles/CBMivwFBVV95cUxQRDhGY01RbmU3eVNmNm9nVUZZaXlmSVZtbnpvc2lIT0l5a3NnRWxOVFdhWjBmOE1fSlNUMG1zS25KOS1Uamc3VXVIaFFpRkRGdEViRnY0RS1wTnhZRXoten",
      "role": "unknown"
    },
    {
      "evidence_id": "E20250328-208",
      "reason": "2025-03-28にBloomberg.comで関連ニュースを確認。タイトル: Japan’s Stocks Set to Sink on Tech Selloff, Middle East Worries - Bloomberg.com 概要: <a href=\"https://news.google.com/rss/articles/CBMiswFBVV95cUxOUGRlSFo5eUZvZlBYcFVQeGkxZEt3clBWZ2RvVmtITWtjM24xVEMtR3dJU3Zwb2lObzZlSEd4QnMzRWR3bVdOR1lqb0M2UDJqcFVuX3Y3cm50bWVhQV8tcX",
      "role": "unknown"
    },
    {
      "evidence_id": "E20250328-209",
      "reason": "2025-03-28にjpx.co.jpで関連ニュースを確認。タイトル: Selection of SX Brands 2026 - jpx.co.jp 概要: <a href=\"https://news.google.com/rss/articles/CBMihwFBVV95cUxQX05KUUNvVVh6enhuWUstakpNbXRsNTRTT19GNV9ZM1FlSk51ZkNXYUcwU085NjF2VVg2aDlOTnB1VFpIa2x2VV84cnpKUVFOeGhJU2Eyb255V3FDTXJUTU",
      "role": "unknown"
    },
    {
      "evidence_id": "E20250328-210",
      "reason": "2025-03-28にReutersで関連ニュースを確認。タイトル: Japanese investors bought $14 billion of overseas stocks in March, most since US tariff shock - Reuters 概要: <a href=\"https://news.google.com/rss/articles/CBMizwFBVV95cUxQVm5qVG9CSnpFd1VFUjBramFWYlJrTDY4X0FzemhZOEtGVFFFV21qaTY0SElIeDhRMTRFcUFmX1JqaUtBRnpOTVM1VVUzNUNnOGxkZFpGTlF1SjZyWXBtTG",
      "role": "unknown"
    },
    {
      "evidence_id": "E20250328-301",
      "reason": "2025-03-28に日本取引所グループの公式IRページを確認。 タイトル: 株主・投資家情報（IR） | 日本取引所グループ。 概要: 株主・投資家情報（IR）のページ。東京証券取引所、大阪取引所、東京商品取引所等を運営する日本取引所グループ（JPX）のサイトです。",
      "role": "unknown"
    }
  ],
  "view_change_conditions": [
    {
      "condition": "同方向の価格・出来高Evidenceが複数営業日継続する",
      "effect": "現在の方向性判断の信頼度が上がる",
      "related_evidence_ids": [
        "E20250328-001",
        "E20250328-002",
        "E20250328-003",
        "E20250328-004",
        "E20250328-005",
        "E20250328-051",
        "E20250328-061",
        "E20250328-201",
        "E20250328-202",
        "E20250328-203",
        "E20250328-204",
        "E20250328-205",
        "E20250328-206",
        "E20250328-207",
        "E20250328-208",
        "E20250328-209",
        "E20250328-210",
        "E20250328-301"
      ],
      "related_hypothesis": "短期需給・材料反応の継続性"
    },
    {
      "condition": "IR、EDINET、ニュースで反対方向の材料が確認される",
      "effect": "価格Evidence中心の暫定判断を見直す",
      "related_evidence_ids": [],
      "related_hypothesis": "価格反応の背景要因"
    }
  ],
  "warnings": [
    "deterministic_baseline",
    "not_investment_advice"
  ]
}
